{
  "schema_version": "1.0",
  "opportunity_id": "calc-001",
  "revision": 1,
  "blueprint": {
    "app_name": "简易计算器",
    "accepted": false,
    "summary": "简易计算器：1 个功能屏，持久化 UserDefaults",
    "estimated_complexity": "low",
    "open_questions": [
      "是否支持连续运算（如 1+2+3）？",
      "历史记录是否需要持久化到文件或仅内存？",
      "是否需要支持科学计算功能（如平方根、百分比）？"
    ]
  },
  "agent_b_status": "needs_clarification",
  "reasons": [
    "缺少计算器核心功能（如数字输入、运算符、结果计算）的具体描述，仅列出首页示例，无法指导实现。",
    "core_logic 中 persistence 描述过于简单，未说明 UserDefaults 存储的数据结构（如键名、值类型）。",
    "ui_layout 仅指定 navigation 为 stack，缺少具体布局细节（如按钮排列、显示区域）。",
    "features 中 items 包含 '历史'，但未定义历史记录的交互（如点击查看、清空）。",
    "未指定计算器支持的运算符（加减乘除）及运算优先级规则。",
    "缺少错误处理（如除以零、溢出）的说明。"
  ],
  "suggested_rules": [
    "在 core_logic 中补充计算逻辑：定义输入状态（数字、运算符、结果）、运算函数（支持 +、-、×、÷）、优先级处理（先乘除后加减）。",
    "在 core_logic 中明确 UserDefaults 存储结构：例如键 'history' 存储 JSON 编码的数组，每个元素包含表达式和结果。",
    "在 ui_layout 中补充布局细节：使用 VStack 包含显示区域（Text）和按钮网格（LazyVGrid），按钮包括 0-9、+、-、×、÷、=、C、AC、小数点。",
    "在 features 中为 '历史' 添加子功能：点击历史项可回填表达式，提供清空按钮。",
    "在 core_logic 中添加错误处理：除以零显示 'Error'，溢出显示 'Overflow'。",
    "在 branding 中补充图标设计：使用 SF Symbols 或自定义图标，确保符合 iOS 风格。"
  ],
  "created_at": "2026-05-16T13:35:40Z"
}